{
  "schema_version": "1.0.0",
  "proposal_id": "prop-pilot-001",
  "candidate_id": "cand-pilot-001",
  "repository": "sentinel-research-lab",
  "baseline_sha": "0000000000000000000000000000000000000000",
  "objective": "Add pilot documentation note and fixture marker",
  "evidence_refs": [
    "docs/SELF_IMPROVEMENT_LOOP_V1.md",
    "tests/self_improvement/fixtures/candidate.json"
  ],
  "allowed_paths": [
    "docs/**",
    "tests/**"
  ],
  "forbidden_paths": [
    "database/migrations/**",
    ".git/**"
  ],
  "patches": [
    {
      "path": "docs/SELF_IMPROVEMENT_NOTE.md",
      "operation": "CREATE",
      "unified_diff": "diff --git a/docs/SELF_IMPROVEMENT_NOTE.md b/docs/SELF_IMPROVEMENT_NOTE.md\nnew file mode 100644\n--- /dev/null\n+++ b/docs/SELF_IMPROVEMENT_NOTE.md\n@@ -0,0 +1,3 @@\n+# Self-Improvement Pilot Note\n+\n+Created by offline pilot.\n",
      "expected_preimage_sha256": "",
      "expected_postimage_sha256": "59ee871cf7163a21f60778e3decb57c95e5bf4ab566da6b5ccdcd46d81685f09"
    }
  ],
  "validation_profile": "DOCUMENTATION_ONLY",
  "acceptance_criteria": [
    "docs note exists",
    "validation profile passes"
  ],
  "risk_level": "LOW",
  "rollback_strategy": "Discard local candidate branch; do not push or merge.",
  "human_approval_required": false,
  "implementer_id": "srl-implementer-agent",
  "repair_attempt": 0
}
